,Original Output,Seq2Seq,VAE,GAN
0,why was orlando bloom sad when he realised he wasn ' t able to build small toy houses ? because he was legolas ., i just realised about legolasting legolas . but when i realised what is a legolas ? legolas, i was able to be able to build a legolas . i was able to build a legolas ., you can tts on girlfriends on brick are on on brick on the brick wall on brick
1,why aren ' t there any white jokes on r jokes ? because jokes are the white man is burden ., jokes about the jokes about the burden is burden ., what is the best part about being a blogen ? jokes ., rich men because of his girlfriend because they are burden because juan because juan like eden
2,"you can ' t run through a campground , you can only ran because its past tents"," why can ' t you ever see a campground because it ran through a campground , it is past tents .", ran through a campground you ran through the campground they ran tents ., how can you run crazy when they ran on a campground they don ' t run on leather cycle
3,the secret of living to 100 years old is patience, what did the doctor say to the doctor for a living ? i can ' t have patience ., nice to a living in a living room for a living room ., nsfw how if throw trucks on the air pole dunnnnnnnnnnnnnnnnn
4,why can ' t you get out of a sex cult with r . kelly ? once you are inurine, what do you get when you cross a nudist beach ? r kellyine ., what do you get when you mix a reline ? pee .," you why do rese , tudor are the courageadad"
5,what is samsung ceo is favorite movie total recall, what did the pirate say to the other ? aye matey, what is the best part about a gay man ? a little whine, you don t look like as flaty white ? it was a white
6,what did the clock say to the other clock after she gave him a handjob ? now give me a second hand job, what did the clock say when he gave me a clock nut ? it gave me a clock nut ., what did the fish say to give a handjob ? a clock ., offensive joke do you give it to are the clock in the clock re
7,why is the dyslexic black guy labeled an uncle tom ? he keeps writing fuck the pocs ., what did the mexican say to the other ? pocs pocs ., what is a pocs is favorite drink ? pocscs, offensive if you think of pocs has a pocsphone in the pocs
8,why can ' t pirates finish the alphabet ? because they get lost at c, why did the alphabet fail alphabet ? because the letter of the c ., why is the alphabet like the alphabet ? because they are c ., you can crude why do they play with the streetest halo holes on the street ? they are .
9,why can ' t virgins play baseball ? they can ' t score, what is the score of score is score ? score, what is the most dangerous part of the most dangerous ? a bad joke, what do you call rudolph on black ? cycle on the cycle path cycle on it cycle on a cycle
10,i saw so many people begging for money in tallahassee today . this city is full of panhandlers ., what did the horse say when he saw a car about money ? he saw a pankars, i saw a new year old girl in the city . he was full of money ., the rich bunch of angry air has the king cyclehanrist than king arthur only made in the city
11,don ' t worry if you have been cheating on your taxes . it ' ll be fine .," don ' t worry about cheating , taxes . taxes . i ' m fine .", i cheating on my taxes and i ' m cheating on my taxes . i ' m fine ., utter rich rich when people play away away away away away away away away away away away .
12,what do you call a judge with no fingers ? justice thumbs ., what do you call a judge who has been a judge ? a judge ., what do you call a black man who can ' t give a black man ? a bro, why should we call a b b b b b b b b b b b ? b b b
13,i hate russian dolls . they are so full of themselves ., why did the bicycle fall off the road ? because he is full of themselves ., why are black people so full of themselves ? because they are full of themselves ., does the rain and rainy blush buh buh ? buh buh buh dum tis b
14,why are weathermen not to be trusted ? because their judgment is clouded ., i ' m in the rain and i trusted . i trusted ., i ' m not a judgement snowflakes . i don ' t trust the only time ., howindraph do richy of pearlmen are only ? fhug
15,you know when you have that urge to eat something just because it is there that is how i lost my job as a gynaecologist ., i lost my job as urge to be a gynaecologist . it is just urge to know why the urge to get rid of the urge to get rid, how does a gynaecologist say when she lost his job at a gynaecologist ? a guy is a gynecologist ., how know americans know when he lost his job cycles are lost on the nuclear garage
16,what do metal heads do when they masturbate ? they slipnut, what did the mexican say when he was watching a slipnut ? slipnut, what did the pirate say to masturbate ? he is a slipnut ., how are you pour shoes red nuts on a strawberry wear warm oven ? they smell like turd coat .
17,a friend just grabbed my coke can and destroyed it . that is soda pressing ., my friend has grabbed the college and destroyed the same reason that grabbed his coke . he grabbed his friend ., i grabbed my friend from my friend today . he grabbed me and destroyed the years ., how do moonwood cyclewood fans like on christmas you are destroyed on your parkinson cycle
18,i saw an article that said reddit shutdown . i had to read it a couple times to be sure . maybe i just miss reddit, i saw an article about an article about an article about an article about an article about an article about an article about it sure i should read it, i just read an article about an article about the new years resolution i ' m not sure i ' m not sure ., wanna know who once was ed ed ed was are ed ed ? they saw the north pole dum tss
19,what fictional city can isis not invade by land ? gotham city ., what caused the land of land ? land ., why do native americans hate the isis ? they invade land on land ., how jordan ants do you like cwood fans on mount ? dats are on mount bowie holes in da
20,"tifu telling my history teacher that the russians sunk the lusitania with a you boat whoops , wrong sub .", what did the pirate say to the other ? lniania, what did the lushin say to the lnieur ? luctus, how does r on benienohnoh like it was bad has you seen
21,why did the doctor call the post office ? he needed help delivering a baby, what did the baby say when the baby was a baby ? baby boomers, what is a baby is favorite drink ? a baby ., carrie fisher can blame on the baby because they don ' t allow female places female places female places you
22,i showed up late again for flying trapeze practice so they let me go ., i showed up late to go to the local restaurant i showed up late to go to the cold shoulder ., what did the cannibal say to the other ? let him go to let the other ., wanna know how men votes on a female cycle ? it ' ll let me go b b b
23,lemme tell you about this amazing dream i had today wait what was i talking about ?, i was talking about talking about my dad joke but i was talking about me ., what is the worst part about being a gay person ? a little boy ., wanna hear gardener as you landed in a female dog because if they are talking about the jordan snopically
24,what is the best part about having sex with a transsexual hooker ? nsfw you can reach around and pretend it went all the way through, nsfw what did the chinese man say to his wife to be a lot of sex ? nsfw he went to be a way to be a little lighter, nsfw i went to my girlfriend and i pretend to pretend to pretend she is having sex with me ., nsfw why do blondes do when they put ? ? ? ? ? ? ? ? get han solo
25,i have eaten peking duck every day for the past year . i need help . i am hooked on quack ., hooked up with a duck and hooked up with a quack ., i have been hooked up a duck . i have been hooked up ., big notice notice bitches are red centuries one day and we are blue the cycle fle
26,my girlfriend plays soccer . she is a keeper ., what is a keeper is favorite meal ? a zoo, what is a keeper is favorite number ? a keeper, scented of king cyclesburg him . they ' ll only play it .
27,my buddy tells me he doesn ' t take criticism too well . i told him he should really work on that ., i told my dad joke well i told him that i would rather be a huge fan .," why did the blind man fall into a well ? because he told him well , he was a well .", geologist cycle why does they celebrate for well muffins are on well ? well crimea river .
28,how do you sink a submarine full of blondes ? you knock on the door ., knock knock who is there ? there is there ? stupid sink ? nurse sink in the sink, how do you sink a blonde ? knock knock who is there ?, wanna parburg on an paral ackbar ? they are on on on the door hose
29,it takes 45 muscles to frown and 10 to smile frown all day . get ripped . gains .," i have been pouring in a romantic day , i have a pain in the other day . i have no pain in the other day .", i have gains to berown . but i ' m not a frown ., how does the ambulance ambulance has one leg on one legrown in the other day .
30,how do blind people drive ? with stick, what did the stick say to the stick ? stick ., what is a stick of a gay bar ? a stick ., childish ladies do you look on your bleetular ladies like pissing your blender
31,my friend asked me if i wanted to play with his deck of cards but you don ' t even have a full deck just deal with it, why did the deck of cards play poker ? because he wanted to play the deck of cards ., why did the hedgehog go to the middle east ? because he wanted to deal with a deck of cards ., don ' t when louis briminate a neo nazi . because they only won ' t .
32,"if you are here for the yodelling lesson , please form an orderly orderly orderly orderly queue .", what did the pirate say to the other ? aye matey, what is the best part about a gay man ? a little whine, how tribe the only swedish boy on one direction tried to play on the street .
33,someone just told me macedonia changed it is name i asked them fyrom what to what ?, i told my name to someone who told me that is a fyrom dice . i told him that is a fyrom dice ., someone asked me if someone is name is a new york . i asked him if someone is name ., the name are on march grenades then you asked him what froman ?
34,why did the cannibal eat the latino midget ? he was in the mood for a little mexican ., why did the man get upset when he chose spacey ? he was very upset ., why did the blonde get pregnant ? because he was moodi, you toestalines for the winter who are not running from the moodymphnorio
35,what did the scientist said after mixing oxygen and magnesium ? o mg, what did the indian man and magnesium started mixing over ? magnesium, what was mixing and magnesium and magnesium ? mglasses, wanna know what flaming of dutch men ? if you heard it was a cycleky the cycleest cycle
36,what do you call a cult that is hard to get into ? difficult, what do you call a cult that makes a cult ? hard to get a cult ., what do you call a cult that is not a cult ? a cult, how are dry strippers as fat breeze like bluepical to be a warm infection
37,what is the only letter in the alphabet that does not appear anywhere on the periodic table of elements ? the letter j ., what is the most redundant alphabet that is the highest alphabet ? the alphabet, what elements the letter is favorite letter ? a letter ., how sally throw his mouth as his grandfather won the tase he won t worry he has won t double willy won
38,what do you say when you offended a canadian but just don ' t care ? sorry if you wanted an apology ., if a canadian is a canadian tourist i wanted to say to the other . i ' m not a canadian ., what do you say when you offended an apology ? african african african african african african african african african african african african african african african african african african african, whose ladies can say when they are black in blu brular tablets tablets they only say they don ' t care . sorry
39,"when someone says i love you , i say i love you more because life is a competition and i must win .", i love a competition for stockholm syndrome . i love you can say that is the competition ., what do you say when you love a competition ? a competition ., wanna know how wind holes holes holes on a wall ? they say they are nice wave on air conditioning
40,what is the most immature gaming console ? ninutendo 69, what did the pirate say to the other ? aye matey, what is the best part about a gay man ? a little whine, how are you heading through romno ? you are chasing your best friend . then you are chasing your nuts .
41,why can ' t you date a flat third ? because it is a minor ., why did the guitarist get a date ? because he was a minor, what is a minor is favorite song ? a minor, i date if a pterodactyl apologize are on the glass or it or hell .
42,why are hurricanes named after girls . because there not himicanes, why are black girls so girls ? because they are both demanded ., why are there no tissues ? because they both have a hot dog ., rich do seaweed do when wear f ' ? ? it is on . .
43,what did the british woman say when she left for the bathroom ? toodle oo, what did the russian roulette say to the bathroom ? where did the bathroom say to the bathroom ?, what did the left say to the bathroom ? where is left ?," public do , a moon smell it is car cycle but it is a buffole"
44,ghosts make the worst liars you can see right through them ., what did the pirate say to the other ? aye matey, what is the best part about a gay man ? a little whine, how did you throw mugged raatnoving has passed away on the cycle coat factory coatadadadadad
45,"thieves thieves had broken into my house and stolen everything except my soap , shower gel , towels and deodorant . dirty bastards .", my towels are broken . towels and shampoo ., thieves stole everything and stole my house in the house . they can pick up rooms ., horse seems on air wars we smell circum a house they are fuckin ' we should smell
46,why should you not vaccinate your kids ? so they will live everyday as if it was their last, i have never vaccinate my kids . but i have no one to have any kids ., why do you vaccinate your kids ? because they don ' t last ., know are the kids who belong in their school ? because they are in to
47,why did frosty drop his pants ? because he is a pervert that likes showing people his snowballs ., why did the woman like a pervert ? snowballs was a pervert ., what does a pervert say when he is a pervert ? a pervert, how they make on male cowboy do they bin laden have on ukraine ? they ' ll never forget
48,what has two rear ends and likes to kill ? an assassin ., what did the veterinarian say to kill himself ? i ' m an assassination ., what is the best part about being a hard time ? an assassin ., how do you call bmw has one tipping ? he gets leaked one
49,what does a near sighted gynecologist and a dog have in common ? a wet nose, what do a dog and a dog have in common ? they both have cunning stunts ., what does a dog and a dog have in common ? they both have collar id, police has so rich commenters rejected the black holes they had one black holes
50,anniversary knock knock who is there ? 9 11 9 11 who ? you said you would never forget, my friend said i ' m a huge fan of a new year old friend . he said he is a real dick ., i said i ' m not a good joke about the correct answer ., king how do seaweed do f who when buh frist are ? b b brbert .
51,"the british prime minister is releasing an aquarium based instant messaging service it is called koi carp dm , by teresa may", what is stamp pies called teresa ? cyromaniacs ., what is the alpha is releasing a new cent ? a new york jets ., don t worry if they were releasing snowflakes as the female ladder but they are releasing it wouldnt worry they are honest
52,"sometimes at work i like to run around holding a screwdriver , yelling attention everybody this is not a drill", sometimes i like my women like a screwdriver . sometimes i ' m not a screwdriver ., i like my wife i like my wife i like my doctor . i like my doctor ., can we rush of air wars air wars on red rain bleading ? because bu wouldn ' t get exhausted
53,"early i know it is early , but a very happy new year from the premature ejaculation society .", i don ' t know why people never invite me to be early . they are really hard to be the early word ., why do you know why the blind man is early ? he is too early ., people know why rich people died for white ? he has one hand the brazilian buch ness .
54,"what did the boy with no arms get for christmas ? i don ' t know , he hasn ' t opened it yet .", did you know that boy got for christmas presents for christmas ? he hasn ' t opened him yet ., did you know that the boy asked me to get for christmas ? he hasn ' t opened it yet ., how do you enjoy jason has some legs run for christmas presents like it yet ranchs they don ' t know yet
55,"it is allergy season . if my nose keeps running , i ' m going to have to buy it new shoes .", i ' m going to buy a homeless man . i ' m going to buy a little hand ., i was going to buy a new year old son . i ' m going to buy it .," wanna know how doreeze , are on female hulk than land on female hulk ? because blub blub"
56,i don ' t understand auto tune neither does my mechanic," what did the mechanic say to the mechanic ? mechanic ugh , i ' m a mechanic .", how do mechanic make a mechanic ? a mechanic, ladies canacotycot is so on on the cycle
57,i wanted to buy some bread from a south asian bakery but i didnt get any because they said they had naan x200b i will leave now, i wanted to leave the indian restaurant but i wanted to leave the other ., i wanted to leave a whole year old son i said i wanted to leave the whole world ., rich how do you like to buy cruise ships . they were not a strawberry of the dough wars .
58,i have just been rushed to a e after swallowing some lego . the doctor is don ' t seem worried but i ' m shitting bricks," lego , i ' m just spitting to the doctor before swallowing lego . she is just swallowing lego .", i was rushed to my doctor and i was rushed to build a giant crab .," wanna do the doctor , if she has it on carpet licking the horse"
59,what do you call a women that catches fish ? annette, what do you call a women who catches you annette ? annette, what do you call a women in annetters ? annette," womb name actors , more than rain female ' tristowtte female dies they are still able"
60,what is the most religious drink ? apple jews, what did the pirate say to the other ? aye matey, what is the best part about a gay man ? a little whine, blondes has aladdin air balloons than king arthur friend does king like ? juan on a king
61,what do you get when you cross darth vader and an elephant ? an ele vader ., what do you get when an elephant is an elephant ? an elephant ., what do you get when you mix an elephant ? an elephant, you decayw of the elephant ed path shirts in his ed paths because it was because of his ed
62,celebrity chef anthony bourdain is to be cremated . gas mark 7 for about 40 minutes should do it ., why did the bicycle fall off the senate senate restaurant ? because he was cremated ., what is the best part about being cremated ? a healthy body ., how do moon paint as grandpa breathe breathe away ? it tastes like disneyland stolen on my lighter
63,where do doctors grow ? the field of medicine ., how did the farmer find out of medicine ? he was a field ., what does a cattle say when he is a cattle ? a cattle field ., the scarecrow has do the cycle as much medicine ? it was the field ed pathtelrus .
64,what did 0 say to 8 ? nice belt ., what did the belt say to the other ? nice belt, why do you never see an 8 year old ? because they are nice ., wanna hear airmaker from bru b b ? b b b b b b b b
65,a teacher asked what the most flammable thing is a jewish kid said oh me me me while raising his hand the teacher said good what, what is the worst thing about jewish people ? you are raising a hand ., raising a jewish girl is a hand . his hand is raising raising raising raising raising raising raising raising raising raising raising raising raising raising raising raising raising raising, how does you wanna put on handker on your hand ? your hand are chasing your hand
66,i bought fake rocks shamrocks, what did the pirate say to the other ? aye matey, what is the best part about a gay man ? a little whine, you wanna do if you truly do like accidents on mount everest accidents in the lungs are
67,what do you call a helium balloon shaped like albert einstein ? a stable genius . original, what do you call a chinese man who is original content ? original content, what do you call a fat psychic ? a little whine, how call a cycle cycle of cycle if they are lower than the cycle path cycle path cycle path cycle path cycle path
68,"guys , we have a problem it is almost 2019 what are we going to eat ?", guys are going to eat a negative person is a problem with a negative one .," guys , i ' m going to eat a problem with a problem with a pretty good joke ."," despite guys when they are going to be a problem in it , i can t be it on"
69,why is dark spelt with a k and not a c ? because you can t c in the dark, what is the best thing about the c in the dark ? k c ., what is dark spelled in the dark ? k . k . k . k . k . k . k . k . k . k . k, creeze has reported freeze if he had to flick holes in clele .
70,i threw a take your phone out and stare into the screen party the other night . it didn t go well considering everyone socialized instead ., i threw a phone on the night i stare at night . i threw it up and i threw it up night ., i threw a phone in my phone today i just threw a phone . i said maybe i threw a phone .," richuh dumk , stare it airburg ? they are a cuh dum king barkburg it"
71,i studied abroad too bad i got busted for peeking in her window ., why did the blind man fall out of the window ? he was bad at the window ., how is the window ? peeking a window ., trash do you call the window rich ? peek on the window
72,why do women wear high heels ? keeps them on their toes, what did the deaf hooker say to his friend ? i ' ll keep on it ., what keeps the best thing about your toes ? keeps the toes ., shakespeareyou do when if the air force asks if you throw emin ' taurus
73,be careful of egyptian sharks they can smell blood a nile away, be careful that is a lot like a new hero . be careful that is a little bit ., be careful that is careful of careful of the worlds careful ., what does poland want for a cycle rover get away the cycle rover away ? it is only
74,39 and 40 had a fight . 41 ., a fight is a lot of women . i have a fight with 4191 .," 39 , i have been a fight with 4 .", how does mickey knights know when he has 319 ? because he eats his shower as you are 401
75,did you hear that president trump is giving out free microwaves ? because he is saying hello with his tiny hands ., did you hear about giving me giving me giving away giving me giving me giving me giving away ? giving me giving away ., did you hear about the new zealanders ? it was giving me a little stiff ., why are you then brush his boots ? the cycleest cycle ? a cycle path
76,is this true ? heard a chinese guy saying today that theresa may has called for a general erection ., have you heard about the new arabian baker ? it is true ., have you heard about the new movie about the new york ? it is called it is called it ., how are cycle cycle cycle cycle cycle cycle cycle isn ' t it only his own cycle path cycle path cycle
77,all these vagina jokes are getting old i apologise if i ' m ovary acting, what do you do if you fly across a gay bbq ? ovary acting, what do you do if you cant stop masturbating ? apologise,"hooordal , micheal jordan staff infection cream jam . micheal dumpty ' wipe away"
78,so i told my wife she would look sexier with her hair back apparently that is not a nice thing to say to cancer patients ., i told my wife i told her i had a good joke but i have a loco motive ., what do you say when you are a wife ? i told her to say ., the cycle system do when they are told his edrist is only truly edvs king cycle
79,you know you are wrong when youtube commenters start agreeing with you ., you know what you are wrong ? wrong ., i don ' t know why people are wrong . they don ' t know what they are wrong ., how do you know if trees gets mugged so many bbq jokes are not wrongfully like you .
80,blonde ipad q why did the blonde put her ipad in the blender ? a she was trying to make apple juice ., i have ipads a ipad in a blender . i ' m trying to be a little bit of a blender ., why did the blonde go to the blonde ? because he was trying to make a ipad ., why did you eat black europeans are on blender ? because if you are putting a blender on .
81,there are 10 types of people in the world people who understand binary and those who don ' t .," there are 10 types of people are binary and those who understand binary , those who are gonna be a real dick .", people are like a new york jets ., why tribe cycle do the cycle for only saudi arabia ? because they only won the cycle air force smaller than cycle
82,"her on tinder i ' m a model on instagram what do you do ? him i ' m a soldier , on call of duty .", what do you call a soldier with a soldier with a soldier ? a high steaks ., what do you call it when a model has a model on instagram ? a squist, you know saddest chuck norris has been in the galaxy another man will be a single
83,a man knocked on my door asking for a donation towards a new public swimming pool . so i gave him a glass of water ., a man knocked on water and a half engineer . i gave him a donation towards the local swimming pool ., i gave a glass of water . it gave me a glass of water ., how does you run out of a juice factory you don t get home because you gave him a glass away .
