,Original Output,Seq2Seq,VAE,GAN
1503,what is the most attractive thing about amy schumer ? her gravitational pull, what did the pirate say to the other ? aye matey, what is the best part about a gay man ? a little whine, you do by cycle if han solo was on a car pole ? because he was only brief goofy
1504,why did the guy going to the gaming convention dress as a grasshopper ? it was a locust cosplay ., why did the grasshopper go to the gaming convention ? because he was a focus on the focus ., why do you never play the paris hiding in the gaming ? because they weren ' t even ., what do the blondes say when the grasshopper diedburing the grasshopper ? icy it was the grasshopper
1505,"i ' m considerate of everyone reading my posts , i put a dl cr in dyslexic can ' t read .", i ' m dyslexic and dyslexic people in the other print . i ' m considerate ., i can ' t read a joke about my posts about my posts it is a dyslexic personate ., how can you consider this hot the netate on ? it has been licking your posts from a non cycle .
1506,anyone need some old copies of chiropractor monthly ? i have lots of back issues ., lots of people are like lots of 3d breasts . lots of monopoly money ., why do you never trust a gay man ? because they are not a little meteor ., december braphy on december 31 one bad blub b
1507,what is a teddy bears favorite food stuffing ., what did the pirate say to the other ? aye matey, what is the best part about a gay man ? a little whine," you can t rain , steam holes in arkansas it falls off if you throw it away on the air"
1508,what do you call an aligator in a vest investi fancy as fuck, what do you call a fat psychic ? a fuckgator, what do you call a fuck up ? an aligator, since two therapists are on the first time they call me first they call me first they are always conceived
1509,what kind of car does a viking drive ? a fjord, what kind of car does a car do when a car does a car crash ? a fjord, what kind of car does a car drive ? a fjord, doctor has a f on floaches than flush on the f more than f more than f
1510,what do you call the devil is tree ? luci fir, what do you call a cheap circumcision ? a devil ., what do you call a dead devil in a tree ? a dead devil worshipper, how crappy the devil spilled when chuck norris spilled it ? book
1511,how do we know that al gore invented the internet ? because everything runs via the al gore rhythm, how do you know if you are on the internet ? you don ' t know how, how do you know if the internet is on the internet ? the internet quack ., how can you know hellen keller on on on on ? they don t know on
1512,did you know chickens die when they have sex ? the one i fucked did ., did you know pigeons die after sex ? one is fucked yourself ., did you know pigeons die ? one is fucked ., you why do you know which one swedish in the blue man ? because of a are fucked blue
1513,canada post is going on strike . so i wrote them an angry letter ., i wrote a new universal remote control pill but i wrote a new issue . i just wrote a little lighter ., i wrote a new book about strike . but i wrote a good idea ., people should election vote for men ? they wrote the cum streaming . .
1514,why aren ' t guys under 6 feet attractive to girls ? because they are dead, guys guys are dead . but all girls are dead ., what did the guys say to the other girls ? the guys ., land if you guys throw of guys because only guys are like throw away airforce
1515,i don ' t objectify women . but grammar does ., grammar nazis are grammar ., what is the least spoken language ? a grammar nazi .," rich people has one red on red bleaks from red , it is red in the grammar ."
1516,what is the difference between an in law and an outlaw ? an outlaw is wanted ., what is the difference between an outlaw and an outlaw ? an outlaw ., what is the difference between a outlaw and an outlaw ? outlaws are wanted to get outlaw ., you don ' t use coffee a kingal dog draft he put him on the coffee wall
1517,"nsfw what came first the egg or the chicken ? the chicken , i don ' t think egg cums .", nsfw what did the chicken say to the other ? nsfw i came first ., nsfw why is the chicken so chicken ? because they are both chicken sedans .," nsfw geologist versus dudes , reverse airkinogets are on flower hee hee hee hee hee hee hee heeee"
1518,they once made a chuck norris toilet paper but there was a problem it wouldn ' t take shit from anyone, i made a negative person who made me a problem with anyone who made me a problem with anyone who made me a problem ., i made a problem with anyone who made me a problem with anyone ., can do you here on reel reel ? don ' t have made your own problem ?
1519,robin the batmobile isn t starting ? batman check the battery . robin what is a tery ?, what did batman say to robin before the orphan ? robinery . they are starting a battery ., what did batman say to robin before he is a tery ? the battery ., you wanna clethyl leaked cwis holes like licking it ?
1520,"a flat earther , a feminist and a vegan are sitting at the bar i only know that coz they won t shut the fuck up about it .", a feminist and a sandwich walk into a bar coz she is the bartender coz you know coz you are just sitting at the bar ., did you know that is a feminist who was vegan ? coz he is a feminist coz he is a feminist ., joke do the r r r r r r r r r it re r it has it .
1521,what is a mexican is favorite cheap trick song ? a texan will tell you surrender but we all know it is i juan you to juan me, how do you know if a mexican is a mexican is a mexican ? juan . juan ., how do you know if you tell a texan who is a texan ? a texan ., does the dog know when a mexican asked what do you know ? juan are a texan happy juan
1522,if i had a dime for every math problem i get wrong i would have 1 . 46, if i had a dime for every time i would be a lot like i would be a lot like i would be a lot like i would be," if i had a company , i would have 4 cents , i would have 4 cents .", seems very time do you wanna do ? ? ? ? ? because they are like the same ? ? ? ? ?
1523,how does a narcissist unscrew a lightbulb ? they just hold on to it and let the whole world revolve around them ., how did the pirate get a lightbulb ? let him hold the whole house ., how many feminists does a lightbulb ? they both hold to go to the lightbulb ., how do you watch when swedish men grab crist b b b b b b . b .
1524,today i gave a student detention for being tardy i was then fired from my job as a special ed . teacher, today i gave my job as a teacher i gave her a job as a teacher ., today i gave my job as a teacher today . i gave me a tardy ., how many you can vote like on tect you . they gave him a tardy .
1525,who is the king of pulling out ? king arthur, why couldn ' t the king laugh at pulling out king arthur ? because he was pulling out of pulling out pulling out pulling out pulling out pulling out, why is the king of the king arthur is favorite movie ? because he was pulling out of his own .," wanna know guys , they are pulling a wise man outside than pulling a nice hand alike . pulling it down and pulling off"
1526,why was the feminist happy when the newspaper got it wrong ? because she enjoyed being ms quoted," i enjoyed my new candle standard but i enjoyed it wrong , but i enjoyed it wrong .", i was wrong with a new york today . it was wrong ., how dairy queen can ' t as female king blushlets because they enjoyed it enjoyed that female
1527,"you know , pokemon are oddish but sea mammals are otter", you know what you are otter ? otterish ., you know what pokemon is like regular pokemon ? pokemon, don t know ed monsters eat hot dig you know what is odd ? because they are oddish
1528,how do you call a guard who is taking a piss ? a security leak," security guard to a security guard , a security guard is a guard attack . bartender says what do you call a piss off ? a security guard", what do you call a piss for taking a piss ? a guard tower,verted icy guys do they are nice blub blub blub blub b
1529,there is a fine line between a numerator and a denominator . only a fraction of people will find this funny ., there are only a numerator and a denominator only a fraction of people will find a funny ., there is a fine line between a numerator and a denominator only a fraction of people are not funny .," people , man who would crack off a facebook remake . ediel , because then they couldn t kinga ."
1530,shoveling snow is great exercise satan, what did the pirate say to the other ? aye matey, what is the best part about a gay man ? a little whine, how cycle donoral cycle if on on on on on on on on to the cycle
1531,"feminism is so complicated even i don ' t understand it , and i am a man", feminism is breast cancer is breast cancer ., i don ' t understand why people are like a man ., why do you understand why a man votes to the enterprise ? because that have been incan votes .
1532,why did the can crusher quit their job ? because they were soda pressed ., why did the sperm bank the job ? because they are both a job ., why did the programmer quit his job ? because he was soda pressing ., you ain ben chuck norris and has been chasing his job as in an air pilot in it
1533,what do you call a jew with down syndrome ? a baked potato, what do you call a jew with down syndrome ? down syndrome, what do you call a jew with down syndrome ? a jew, framtal as bad members are bad for mid prelets ? they call us an bad content from mid weeks
1534,three men walk into a bar the bartender says how would you get in here, a man walks into a bar and a bartender says what would you get when you get a long face ?," a man walks into a bar and the bartender says , it would be a long time ."," don t we do r astrono , but it would be a gouda joke blub"
1535,why did the dried up semen cross the road ? i put on the wrong pair of socks this morning ., why did the skeleton cross the road ? he couldn ' t have rauntation morning . he couldn ' t have raider to put his socks, why did the blonde cross the road ? to put her socks in the morning ., how does you tired of your cumnolds man ? he put it the hole tannda
1536,what is the difference between a woman and a vacuum cleaner ? vacuum cleaners don ' t shout at you for not wearing a condom, what is the difference between a woman and a condom ? wearing a condom ., what is the difference between a woman and a condom ? a woman is not wearing a condom ., how if you shout the difference between clucky and manection on your wife ? too many
1537,i swallowed some scrabble letters by accident . my next shit could spell trouble ., what did the buddhist monk say when he swallowed the accident ? he was a little chewie ., i swallowed an accident in an accident . i swallowed the accident ., rich if you ever saw a cold on a cycle on holiday . they are gonna tell juan on accident .
1538,i ' m excited about a black person being on the 20 bill . i always wanted to use black people as currency ., what currency do you call a currency ? wendy, why is the black man so excited ? so excited .," ambulance recall , because if it has been leaked air wars content because it doesn ' t play it because only you play it in rod ."
1539,have you ever tried to eat your own watch ? well it is very time consuming .," why did the doctor fall into the well ? well , watch the watch ."," how do you eat a good joke ? well , i can ' t eat it .", do you watch your angry air dressing if you watch it as well ? well air are .
1540,did you hear about the party in the english department ? it was lit af, did you hear about the party that got a party ? they are always blowing willie ., did you hear about the party that got fired from the party ? he was a little meteor ., has been getting tired of the cycle path of cycle path cycle path cycle path
1541,what is the difference between new york firemen and paris firemen ? the firemen from paris were able to save the two towers ., what is the difference between firemen and paris firemen ? there is no firemen firemen ., what is the difference between a golf course and a golf course ? a youtube teacher can ' t be able to save a golf course ., you garage heads when you are rainypical as an leaked car leaked a fire leaked ?
1542,my wife accused me of being immature i told her to get out of my fort, my wife accused me of being immature i told her to get out of my fort ., my wife accused me of my wife immature i told her to get immature . immature . immature . immature . immature . immature . immature . immature .," has you do brown , smile when told me the smile smile . it was fortepish . fort"
1543,why is z the only letter in the alphabet you should be friends with ? because all other letters are nazis ., why are you always so many letters in the alphabet ? because the letter of the alphabet is the only one ., why is the letter to be friends ? because of the letters of the alphabet ., don t you look like reel it are heading on resuctamel .
1544,how did the frog die ? he kermitted suicide . i ' m sorry," what did the pirate say to the other ? sorry , i ' m sorry .", what is the best part about a gay man ? sorry, how do you know why fadadad cream on cream ? sorry has cream ramsay slothed
1545,i was blessed with a 9 inch penis nsfw that priest is in jail now, i was blessed with a nun in jail . she was in jail ., i blessed with a priest with a sneezing person in jail ., wanna name his newbornlad with female cycle from blad blad king has a female cycle . it is a wiener cycle .
1546,what do you call a polish strip club ? poles on poles, what do you call a gassy stripper ? copy pasta, what do you call a poles ? poles poles poles poles ., how does you call juan king cycle rover away rover away king cycle king cycle rover
1547,i wrote a book about diarrhea . i ' m told it flows really well ., i wrote a book about diarrhea . i told them that i have diarrhea ., i wrote a book about diarrhea . i told him i ' m a good idea ., if wrote me of the election it was told me it was because it was in the past tents
1548,i hate people who steal the punchline . i ' m keeping mine a secret ., why can ' t the secret leader tell the secret to steal a comedian ? because he steal all the punchline ., why is the punchline bad joke ? because the punchline is the punchline ., how often can throw on a draft car salesrist if you throw away on the land ed on the punchline
1549,computer science joke what fossil fuel is 1 byte long ? char coal, what did the pirate say to the other ? aye matey, what is the best part about a gay man ? a little whine, expected can confirm what does you play because he doesn t worry because he doesn t worry because he doesn t have because he doesn t fake ben anymore
1550,"what does a jamaican do when he sees a spaceman ? he parks his car , man .", what does a jamaican fly immediately when he sees a man ? a manman ., what does a man say to the man when he sees a man ? he sees a man in space ., how doyou have cycle if you throw on space ? they are naan cycle rover
1551,why was the guitarist arrested ? because he was fingering a minor ., why did the guitarist get arrested ? fingering a minor, why was the guitar teacher arrested ? for fingering a minor, how do you tell cuz aswel press blub blub press
1552,women call me ugly untill they find out how much money i make then they call me ugly and poor, women call me ugly until they find out how much money i find out then i call out how much money i call me ugly ., women call me ugly until they find out how much money they call me ugly until they find out how much money they call it ., moon do as very much better than you have a very much best content you can make it very poor coat .
1553,"whenever i see a female bus driver , i ' m reminded of how far we have come as a society then i wait for the next bus"," whenever i see the bus stop giving me out of the united states , i ' m reminded of the united states . i ' m reminded of the", whenever i ' m elected i ' m elected i ' m elected . i ' ll see myself out of society ., we can t wait for glucky cloth yes sir it reminded you c .
1554,if you are happy and you know it crap your hands ., i don ' t know why people have a happy time i have a crap ., i don ' t know why people are happy . i don ' t know why they are happy ., how does you know micheal jordan has been on holiday on deport on deport on deport on deport on deport on deport
1555,what did the city say to its father before it left for mexico ? ciudad, what did the father say to the father ? he left me ., what did the cadil say to the father ? crisadiudadi, why do people often take away in mexico ? cadad bad bad badad
1556,what do you get when you cross nu metal with professional networking ? linkedin park, what do you get when you cross country with a new iphone 7 year old ? a boo bees, what do you get when you mix a gay bar ? a receding hare line, does you throw his maka breedies on king arthur bree ? because it was breeki bree
1557,what is the difference between a girl and a washing machine ? when i dump a load into the washing machine it doesn t follow me around ., what is the difference between a girl and a washing machine ? a washing machine waits till you dump a load in a load ., what is the difference between a washing machine and a washing machine ? follow you a washing machine and follow a load of dump ., why did you know if it ed on because he couldn t take it on his own .
1558,"what is a pirates favorite letter ? if you said r , you would be wrong . you might think that it is r , but it be the", what would be wrong with a chore language ? i would be wrong ., what would you call someone who is a chile ? a cramper ., wanna know ree cycle of his king cycle reads are it because he is on c
1559,what is black and white that could fall out of a tree and kill you ? a piano, what is black and white and a piano ? a piano ., what is black and white and a tree ? a flat minor ., what are can t absolute bridge ? if it doesn t kill you to kill a wall anymore .
1560,you might have to be more specific when using the word cousin . it is just such a relative term ., i have been using using using using using using using using using using using using using using using using using using using using using using using using using using, using a bad joke about using walkie talkies . i might be using walkie talkies ., why dairy has it they might worry they might worry they might worry it they might not be only sleepy
1561,how does a ghost orgy end ? with a boo kake, what did the pirate say to the other ? aye matey, what is the best part about a gay man ? a little whine, how geologist as a findindkiindki spilled pilot are inhallinypical cycle ?
1562,two cannibals are eating a clown . one turns to the other and asks does this taste funny to you ?, two cannibals are eating a clown . and asks if you are eating a clown ., a clown walks into a clown and asks the other is a clown ., scene whyrates you do murder with you are eating a clown away ? a clown joint pearl harbor high
1563,twitter has banned foreign spy as hate speech . the acceptable term is undocumented knowledge worker ., what did dougdrick lama say to the twitter ? i ' m gonna find it ., what is twitter is twitter ? doug jones, despite how has an angry joke do on twitter smell ? because they are in saudi arabia
1564,the shovel . the discovery of the shovel was a truly groundbreaking moment for humankind ., the shovel was a shovel ., discovery of a discovery of a shovel . the shovel was human ., how are super not hybery isn t luke warm ? spring hankin
1565,i am a prate pardon the missing i ., what is the most popular country song ? a big dick ., what is missing favourite band ? a good idea ., does you know if franch has ? the circum cycle path cycle
1566,"in memory of arnold palmer , i wore my golf underwear today the one is with 18 holes . too soon ?", i was gonna be a new prosthetic penis today i was one of the one of the one . but i have been to be too soon ., wore the wrong word i wore the wrong socks today . as soon as soon as soon as soon as soon as soon as soon as soon as soon, howcinolds has passed with angry coatbyr they are always dropping sandals off my memory
1567,what do priests and ps4s have in common ? they both get turned on by little kids, what do priests and ps4s have in common ? they both have cunning erects ., what does the priests have in common ? they both have in common they both have in common they both have in common they both have in common they, how do you chase an xbox from xbox as a pearl necklacender bitch reads to chase rats away
1568,"the inventor of the oxford comma has died . tributes have been lead by jk rowling , his wife and the queen of england .", the inventor of the the the the the the the the queen of the other of england is a tributes in england . the queen of the, the inventor of england has died . the queen was the queen of england ., geologist inventor if it gets rid of sugar cane ? it gets away than you da juice
1569,my neighbor rang on my doorbell at 3 am can you believe it ? luckily i was still up playing the drums ., i rang my doorbell at my doorbell luckily i can ' t believe i ' m still . luckily i ' m still ., my doorbell is my doorbell . luckily i was still playing monopoly with my partner . luckily i ' m still playing monopoly with my partner ., wanna know if queso has the usa with no usaners ? because it is a crisis
1570,what did the lady say to the attractive creeper ? lurkin ' good, why don ' t you have any new amen ? because they are good for a lurkin, why is the lihakin is good at the libur ? because he was a lurkin, ladies rich truly and blue smiley smile on a lurkin burkin burkin burkin burkin
1571,yo momma so old . she remembers when yo momma jokes were a thing ., yo momma so old she remembers the thing she remembers the thing ., what is the same thing about a good thing ? a virgin ., how are cloudification cycles on the stairs ? they are just a piss on the cycle path
1572,whats the most common reasons why musicians go to jail ? for hitting a minor, whats the most important thing about hitting a minor ? a minor, whats the best part of a guitar teacher in jail ? a minor ., black guys say chul choked on ? dam it on chul c in my minor
1573,"so i ' m writing a paper on suicide , namely falling to death its called jumping off buildings the rise and fall", the rise of the trump administration rise to the other song on the rise of the rise of the rise ., how do you fall into a bar ? the police will rise to be a long time ., how does you sheriff notice when rich catches his indian like indian restaurants are you gourdty nuclear fighters
1574,what is scotland is biggest cause of depression ? lonely ness ., scotland bolt for depression . depression ., what did the shortest century say to the new york ? depression ., how do you know his dairy has been a very average man drowning on him ? an affair . .
1575,for all those people that didn t know that some latin american countries don t primarily speak spanish you better belize it .," there are 10 types of people who understand binary , those who understand binary , those who are gonna be a real dick .", do you know why people are like ? they don ' t know ., i don ' t know why of lubewoodwood has you know it smell
1576,why are catholics against contraception ? because there would be less little boys for them to molest if catholics used birth control ., why are catholics against childception ? because it would be a molest ., why can ' t you contraception against their contraception ? because they would be contraception .," you can t bmw , it would be the road on his sistertra"
1577,what is the colour of the wind ? blew ., what colour blew up colour ? blew up the wind . edit blew up the wind ., what is the colour of the wind ? holy wind," can i car nuts , thomas daee spilled on spring water ? wind land on wind land on windruh ."
1578,it is not goodbye its buongiorno, what is the first year of the bucorn ? buo, what is the best way to buorn ? buorn ., do you wanna say when once voted homesgiorn by cycle ? because they are buaggiorn
1579,i believe in the idea of a free will . i just really don ' t think he should be behind bars . free will, i think i really really like a free sex but i really really really really really really really really really really really really really really really really really really, i think i have no idea i have no idea i really want to be free ., how do crazy people play airwis airwis it is a free air cycle .
1580,what did the blind man said when he passed the fish market ? hello ladies, what did the pirate say to the other ? he passed me ., what did the pirate say to the other ? he passed up ., the male guys freind freind freind freind ?
1581,how did the potato achieve nirvana ? by becoming a meditater ., becoming a great joke https www ., what did the gay say while becoming a gay guy ? ohmr, wanna know when you wanna commit suicide ? because they are only a cycle path .
1582,the russians were hungry so vee ate, what did russians say to the russians ? the russians are hungry ., russians are hungry but russians arerier ., why do you moon jamnovingnovingnolds smell than russians they are fuckin tectonic
1583,"how do you know how heavy a red hot chilli pepper is ? give it a weigh , give a weigh , give it a weigh now ."," how are you heavy a chill , and pepper ? give a weigh now it is very heavy , you know how heavy it is a weigh now"," how do you weigh a fat girl ? give her a weigh , give it a weigh .", don t know how heavy isn ' t it always pissing her
1584,what do you call an anorexic with a yeast infection ? quarter pounder with cheese, what do you call an anorexic with a yeast infection ? a quarter pounder with cheese, what do you call an anorexic with a yeast infection ? a quarter pounder with cheese, how does adele know ? when it anorexicfully to astronomy and mah
