,Original Output,Seq2Seq,VAE,GAN
2248,what did the fish say when it swam into the wall ? damn .," damn damn , it is a wall , it swam into the wall . damn damn , it just swam into a wall .", what did the wall say when it swam into a wall ? damn ., why did you miss whenreeze actors if you are bulletproof in saddam accidents ? because they haven ' t
2249,what did the disillusioned prostitute say at the end of a long day ? why is everything so hard ?, why is hard to end up everything ? because they are always blowing willie nelson ., why is it hard to make up everything ? because they are always hard ., why do blondes call alhaving if you endin schools because they endipts from
2250,what do you call masses of holy water stored up ? goddam, what is goddamn ? goddamnops, what is the best part of goddam ? goddam, the cycle cycle can do on the ice cream band
2251,the man crashed his car into a tree that is when he realised how mercedes bends, i just realised my car is a car . but when i realised i was a car ., what is the best part about being a tree ? a tree ., why do you really hate his car outside the tree are a manace ? they realised his car outside
2252,how do you make holy water out of ordinary water ? boil the hell out of it, how do you make holy water ? you boil the hell out of it ., how do you make holy water ? you boil the hell out of it .," childish , why don t it take away ? because they boil their hell away . it is a hell wave ."
2253,what do you call a sex scene involving odysseus and achilles ? homer erotic, what do you call a gay midget ? homer erotic, what do you call a greek greek greek greek greek greek greek asian ? involving a little chili pepper, does king blondes do it has to run away and violets are it destroyed his female ladies like it is a nice female
2254,it was really difficult to come to terms with the death of my ex . but eventually the assassin and i agreed on a fee ., my girlfriend asked me if she agreed to come into a girl with a girl . but eventually she agreed to come out of the veterinarian ., what did the lie of death with the fee . after the fee . i agreed to be a fee . but eventually they agreed to keep the fee, we should truly come in of terms they truly are truly they truly have han solo
2255,"why do edgy teens want to become a gas these days personally , i don ' t understand the fuss about being a ' vaper . '"," what did the prbin like to become a job ? the gasbror , and the fussbror .", i don ' t understand why people keep pushing the gas . they keep telling me to be fuss ., how does you run on his angry dog ? you don ' t run .
2256,what do you call it when a cat coughs up a rabbit ? a hareball, what do you call a rabbit with a rabbit ? a hareball ., what do you call a rabbit with a hareball ? a hareball, the royal trashuuuuct as your hare fell on the hare seatt and doesnt call that hare
2257,who was the first computer operator ? eve because she had an apple in one hand and a wang in the other, what did adam use to adam have to adam have ? a roman ., eve is eve ? eve ., wanna tell you crumped on adam before eve they ' ll ever freeze a round line in your day before you ' ll .
2258,i wish i could go to a party at mr . peanut is house . i bet his balls are nuts .," i wish i was a party with a party but i bet it is a nice mind , i can clearly see your balls .", i wish my house is a party . i wish i could say to the peanut butter . i could say i ' ll be a peanut butter ., rich people are nuts when theywatchrist ? they wish they like they only had to do nuts
2259,what did the blanket say as it fell off the bed ? oh sheet, what did the blanket say when he fell off the bed ? oh sheet, what did the blanket say when he fell asleep ? a little horse, you know flele as a fat flelelele a castle corpses like licking it .
2260,"what do you call a woman who is very knowledgeable , but has never worn a bra ? an ex pert", what do you call a woman who has a hair ? knowledgeable, what do you call a woman is knowledge of knowledge ? knowledge of knowledge of knowledge ., why do you call a bike a man who keeps stealing away on it ? because it is knowledge
2261,went out tonight and got 8 numbers 2 more and it would have been a whole phone number, i went to the senate race tonight i went to the bar tonight it would be a nguyen nguyen situation ., i went to the french bar today . it would be a very talented question ., you can t f da da da da da on the weather in it has been on da da da da da da
2262,what kind of fuel does the fast and the furious cast use vin diesel, what kind of fuel does a fast person can photo of fuel ? an attorney ., what kind of fuel do fuels drive ? fast food, how can you kind of dairy air ambulance are you are not very annoying because you are not an air rover
2263,how do you recycle a condom ? when you take it off you shake the fuck out of it ., how do you recycle a condom ? turn it out of it turn out of it ., how many redditors does it take to fuck a condom ? it doesn ' t take it out of it ., wanna know what a condom has recycle it is the fuck of rect ? because i ' ll shake it out
2264,"an agnostic and an atheist got into a full frontal car crash , news headlines read heathen collision on the highway to hell .", there is an agnostic friend in the other highway . there is a hell on the hell of the hell out of the hell ., what is the highway of the highway ? the highway ., you don ' t look like chen are on a highway in the highway he has bad luck on
2265,what is black and hanging from a tree in my backyard right now ? a black berry ., what is black and hanging out of a tree ? a high koala, what is black and hanging out of a tree ? a hanging, how mccanns on the christmas day they are in the trees because they are high
2266,"how many millenials does it take to change a light bulb ? none , their parents do it for them .", how many parents does it take to change a light bulb ? none of them ., how many feminists does it take to change a light bulb ? none . they are already lit fam ., howyou cluckyou guys take it .
2267,god must be black he has tons of kids yet no one has ever seen him, what is the last thing that is black and runny noses ? one of them ., what is black and black and one is tons of tons of tons of tons of tons of tons of tons of tons of tons of tons of tons, do you guys with tonse backwards . we won t celebrate chocolate outside . that won ' t get it with tons b .
2268,"at a brothel a man got his dick sucked . however he was very unhappy with his blowjob , so he asked to speak to the head manager ."," a man asked me to the brothel a blowjob . thus asked if he was very unhappy with a blowjob . however , describe the same , but i"," what did the man say to the brothel ? he asked him to say to the man . however , he asked me to speak .", you are truly unhappy creatures because they can ' t speak roof of his blowjob in the brothel
2269,my wife told me she ' ll leave me if i go blind . i guess i ' ll just have to see ., i guess i ' m not a lot like i guess i ' m not a lot like ., i guess you can ' t leave a good time . i guess you can ' t leave .," how do you know , nuclear bend nuclear mattress has to see the nuclear mattress as a nuclearwood rover itirwood"
2270,"to the guy who stole my ms office key , i will find you you have my word ."," to find a guy who stole my word to find a word word word word , i ' m a word .", i stole my scrabble tiles and stole my scrabble tiles . i find out how to find you ., whats you would be a word of milk ? a word of c
2271,how do you get a squirrel to come down from a tree ? drop your pants and show your nuts .," what did the squirrel say to the other ? i ' m in a tree , you can ' t come out of the tree , you can '", how do you get a squirrel to drop a tree ? you can ' t get to drop your pants ., you why do we drop a tree blub blub b ? they are in your pants
2272,why do cows have hooves instead of feet ? because they lactose ., why do cows have hooves instead of feet ? because they lactose ., why do cows have hooves instead of feet ? because they lactose, can t t girlfriends do the for 23some are lactose from
2273,what do you call a rapist with shaved pubes ? a smooth criminal, what do you call a rapist with a rapist ? a rapist ., what do you call a rapist that is a rapist ? a rapist, you should ever spend the louisle of black ladies ? because we call a black man in black
2274,the latest hipster music craze plays songs at a frequency of 50000 hz . you probably never heard of it ., why did the bicycle fall out of a frequency ? because he hertz ., what does songs like a hipster ? a kaz, frequency are you a frequency walking lifts the crazy air lifts it is a crazy shock you than
2275,i don ' t get why girls wear bikinis at the beach . they have got nothing to hide ., what do you get when you hide your job interview at the beach ? a sandy eggo ., what do you get when you hide the beach ? a dead giveaway, malks are worse when it is raining . it is a bleas .
2276,what font do comedians from central asia write their jokes in ? comic stans ., why do comedians never wear diapers ? because they are both jokes ., jokes about centralial jokes about centralial jokes about central america ., how does you do king arthur go as king like his new app ? from king
2277,did you hear the tragedy of the cameraman in the church ? it was a mass shooting ., did you hear about the cameraman who was a tragedy of the tragedy of the plague ? it was a tragedy of the cameraman ., did you hear about the camera that is a cameraman ? the tragedy of the camera .," how should you like many corpse , they have because they only play on restaurants because they don ' t play on restaurants . ."
2278,i like my exes like i like my msn messenger misremembered fondly but gone forever ., i like my women like i like my women like i like my women like i like my coffee ., i like my women like i like my women like i like my women like i like my women ., wanna know what the snowman of gay cars are getting divorced ? you are getting caught to the cycle path .
2279,i used to not believe in climate change but around october i started supporting global warming, i used to believe in a gay bar but i ' m not a real dick ., i got fired from the middle east but i can ' t believe it was a real reason ., you think dog the cycle belongs it was a butterfly it is a cycle wave
2280,what do you get when you take a great dane and cross it with a chihuahua ? a dead chihuahua ., what do you get when you cross a german shepherd and a sub woofer ? a gilliant to get a heavy rock ., what do you get when you take a dan of a danture ? a danny ., how do pets rush when it take away on sunday ? because it was like to cross land away
2281,did you see the preview for the new stephen king movie ? i am excited to see it, what did the new year old say to the previe ? previe is excited for the preview ., i am excited about previe jenner is previe . i am excited ., how do peanuts hate peanuts when the blub blub are in buff ? icy ble .
2282,a blind man walks into a bar and the chair and the table and the barista, a man walks into a bar and a chair . and a table ., a table and a table walk into a bar and a table . a table is chair, people customsno has barista who barista do when he gets angry ? k king like you a king in the table .
2283,why do they call birth control bc ? because that is before jesus came, what did the pirate say to the other ? aye matey, what is the best part about a gay man ? a little whine, many blondes can smell of duct tape smell like they are chasing vodka reads duct tape on duct tape
2284,"today , a man knocked on my door and asked for a small donation towards the local swimming pool . i gave him a glass of water .", today i asked a man knocked on a local swimming pool . i gave him a donation towards the local swimming pool . i gave him a donation towards, today i asked my friend how to the door i gave him a glass of water ., ' t when asked his hair to close his own water . that is a bitter taste .
2285,what is the difference between a pothole and a regular hole ? one is a little higher than the other ., what is the difference between a philosophyhole and a pothole ? one is a joint higher than one one ., what is the difference between a dead baby and a pothole ? one is a pothole ., rich people must think the difference quote cycle cycle cycle cycle cycle cycle cycle cycle cycle because they are only the cycleest cycle juan cycle
2286,how do you join the police ? handcuff them together," police are like a policecuff . religion , and a police officer . sort of hand .", how do you get to the police officers ? they are both together .," can sunburnonicts are more hand , but they couldn ' t join it any handker zin"
2287,what did the saucer say to the teacup ? you have a hot bottom ., what tea does a nosey tea is ? they are both fucking rawup, what did the muslim say to the other tea ? a teacram, whyyou moon do when pearl jamno adopted ? they are on bikes
2288,i named my eraser confidence because it gets smaller after every mistake i make ., i named my dog is hair but i named him ., i named my dog a good joke . it is a good time ., handy has the tweet pal if you named them named dick cane ? they are everywhere
2289,how do you make holy water ? you boil the hell out of it, how do you make holy water ? you boil the hell out of it ., how do you make holy water ? you boil the hell out of it ., how does you celebrate chocolate ? how are youir ? because then they take away on a merry
2290,it is hard to tell puns to kleptomaniacs they always take things literally, why is hard jokes so hard to take things literally ? because they always take things literally ., kleptomaniacs . they always take things literally ., ain ' t when they are a blue joke dad joke ? they take away from it
2291,american politics is like sand it is coarse and gets everywhere ., what is the most important thing about coarse ? coarse, what is the coarser favorite drink ? coarse, rich has knights installed coars on the covse the coarse
2292,i heard that raw oysters are good for male virility but that is not true . i ate 2 dozen and only 5 of them worked ., i heard that pigeons die but i heard they are good at 5 . 5 5 .," i heard that i have heard of a new star wars movie about the new movie . 5 , and it worked it out .", slutty mamas can ' t toto and khan which helps blush on a b otherwise it is a cycle
2293,"yeah , i am a part of peta people for the eating of tasty animals"," did you know that the other part of the part of the part of the part of the other ? yeah , i ' m eating ."," did you hear about eating a gay guy ? yeah , it is a part of it .", don ' ty play on one east brilliant blub blub b
2294,what do you call a blonde with dyed hair ? artificial intelligence ., what do you call a blonde who is a runny nose ? artificial intelligence, what do you call a blonde with a runny nose ? a little whine, how can you call billy as a spent vaccinated he been building far away he doesn t call it indie tracks
2295,you told me i would win the election asked clinton to the devil you told me you had a soul the devil replied, a devil worshipper sold his soul to the devil . told the devil worshipper sold his soul to the devil ., my soul singer is told me to the devil is soul to the devil ., how can you enter delawnokinokinoki ? he has been told you soul .
2296,"hey girl , are you a chinese immigrant from the 1800s ? because i want to make you mine ."," i have been found dead batteries , 1800s are in the 1800s . we are under 1800s .", i want to make a new00 jackson . i ' m not yours .," ice cream , they only make it on the pub maybe they are not mine on mine ."
2297,why is peter pan always flying ? he neverlands, why is peter pan always flying ? because he neverlands, why is peter pan always flying ? he neverlands, how horny one donut the f cky roll inside donut ? one has one .
2298,why did brian cox is telescope break when he looked at saturn ? because he didn ' t titan his lens enough ., why did the titan prepare saturn prepare his saturn ? he was saturnan ., what did the best name after the best part about the video games ? saturn ., how crazy should you play when it gets mugged when they have it reaching the ground . it was titan tit
2299,hmmm i just realized my cake day is on valentine is day, i just realized my valentine is day . i just realized it is a dead giveaway ., hmmm i realized i was a valentine is day . i realized that is why i realized i was a valentine is day ., how are you can bbq day when you asked it they are on a rare lecture joint ? amish
2300,whars long ha nuts on either sude and has an asshole around the corner the hallway in the mental hospital i just i just escaped, what did the indian dwarf say when he escaped from a hallway ? he is a hallyy, what is the best part about being a dead antway ? a standway ., turkish you can are on a pole ? hall 'dicway in the corner of the journey they are a pole
2301,"i thought i got cancer because i made so many funny cancer jokes , but i was wrong . it turned out the jokes weren ' t funny ."," i thought i made jokes about jokes about my jokes but i turned it wrong , but i turned it .", i thought i was wrong with jokes about my jokes . i thought it was wrong ., do you wanna trust air if you wouldn ' t make bbq commercials on his own breath ? it only won t
2302,my dad once told me it is important to always laugh at your mistakes and accidents he then looked at me and started laughing, my dad is very important to the accidents in the mistakes . i told him that is the mistakes ., my dad is like a very important thing i told him that is why i have to be a real pain in the kids ., wanna hear which holes on mistakes ? cause pearl harbor was an important blah boom
2303,climatologist my findings are meaningless if taken out of context . media climatologist claims climate findings are meaningless .," climatory , taken out of context , taken out of context . media scientist scientist scientist scientist scientist scientist scientist scientist scientist scientist scientist scientist scientist", i have taken a new job in tech . my new slogan is meaningless ., you think chumat has taken the grass of the climatologist by it
2304,what is the difference between an epileptic oyster shucker and a hooker with diarrhea ? one shucks between fits ., what is the difference between an epileptic oyster farmer and a hooker with diarrhea ? one shucks between fits, what is the difference between a hooker with diarrhea ? fits with fits ., the how blow blow the other isn t any other or my whole blowjob any other
2305,if only africa had more mosquito nets then every year we could save millions of mosquitos dying needlessly of aids ., what is africa is favorite fruit ? aids, what is the most common between africa ? a mosquito ., wanna know why cristian holes on stomach than stomach cycle reads holes on stomach ? because he was a little breeze
2306,survey found that 1 in 3 democrats are of below average iq the other two are dead or imaginary .," two , two , 000 , but imaginary , but imaginary , but they are both because they are both because they are both a lot .", how many optometrists are dead babies ? they are both of the same one of them ., how can you get tired of crist than only because they urinate away they only urinate away .
2307,"what did the prison guard say when epstein cried for help ? i ' ll be right there , just hang on for a minute .", help me can only hang out to the minute of my girlfriend is right now i ' m not right now i ' ll help me ., how do you get a giant marshmallow ? i can ' t get a giant marshmallow ., how do you call airki are you on a flying roller
2308,if lysis means rupture then i would hate to attend the analysis meetings scheduled for tomorrow, tomorrow i ' ll attend anything tomorrow i ' ll attend anything tomorrow . tomorrow . tomorrow ., i ' m attended a new year old daughter . i ' ll attend her tomorrow .," if you drove recently has a canoe in itbithraliss , it was a shih tzu"
2309,why was the boxers autobiography so funny ? because it was filled with punchlines ., why did the comedian tell punchlines are so funny ? because punchlines are filled punchlines ., why aren ' t there any jokes about the jokes ? because it is a real joke ., how rich do they seem to play filming like angrypicalpicalpicalpicalpical east
2310,"a boy sees an alligator in the zoo and shouts hey are you a caiman ? i ' m alright , thanks kid he replies"," alright , i have an alligator on the zoo . the other is alright , but the other is alright ."," a alligator goes into a zoo , he replies , but alright , cramper .", why peter peter miss peter pan use on raw babies are you can be a single dog float ?
2311,i ' m sorry and my bad mean the same thing unless you are at a funeral ., what did the funeral say to the funeral ? the funeral is funeral ., what is a good thing at a funeral ? i ' m sorry ., wanna know what chuck norris do his funeral and he couldn ' t keep chasing your funeral ? the funeralrier .
2312,why don ' t furries shake hands ? it is a faux paw ., what did the pirate say to the other ? aye matey, what is the best part about a gay man ? a little whine, how do you understand the financialest franklin financial factory recently if you are in the perfume factory challenge
2313,so a british citizen decided to immigrate to the us he wondered why his money were weighed, i wondered why he was a weigh to a weigh now i have wondered money to weighed a weigh now then it is a weigh now ., what is the best thing about being imrateed for the us ? a lotrate ., how do you use air air has a weigh on a brangment ? they are too busy
2314,"my grandpa told me , you millennials are too dependent on technology so i plugged out his life support", why are millennials so much technology ? because they are plugged on the plug of the plugged ., my grandad is deproving . he is depend dental medication ., wanna know what toothpasteinuer areinnofand ? technology when you are following the plugged away in it
2315,"i had a threesome the other night there was a couple no shows , but i still had a good time .", i have a couple of a couple of a couple of a couple of a couple of night i still haven ' t been still a couple of the, i had a threesome with a couple of boobs . i still had a couple of nails ., why spidermans do you and benopaurin bukepop ' tribe
2316,"what should you do after you sleep with a female soldier ? salute her and say , thank you for your cervix", what do you say to the salvix ? you can ' t sleep with a salvix ., what do you say when you thank you to say to the sprevix ? a sprevix, how do you know about his caral car have a good driver that they don ' t
2317,why should you bring friends when tipping a police car for hillary ? stronger together ., what is hillary is favorite thing ? the tipping the tipping ., what did monica lewinsky say to monica lewinsky ? monica lewinsky, hear if groups of election cycle weather are you throw away by election ? because it won ' t throw
2318,what do you call an autumn season that has gone by ? fell, what do you call a new minute that is gone ? a concentration camp ., what do you call a jewish girl ? fell off ., how do ajit pai on an perfume on you have done on on on on on on the perfume ? ajit pai .
2319,the racing career of chris burke and tommy jessop was a disaster they had too much down force, why did the man get so much as much as much as much as much as much ? it is probably a touchy subject ., why do you have a children so much ? because it is force it ., how does king technician has on disaster fishing so much ships fishing float ? beaten . chuck norris
2320,i was going to join a group for people who masturbate . . . but i ' m just not feeling myself lately ., i was going to join a group of people who join the group of people who join the other people who can ' t join the little," i ' m going to masturbate a group of people . lately , but lately , but lately , but lately , but lately , but lately .", can moon with why are they been getting away ? they are getting the cold shoulder
2321,why does america need a huge army ? to compensate for shitty presidents like bush ., what do you call someone who is a compensate ? compensate, what is compensate ? compensate, like you think it might suck at him because it is not bad as they might not see it .
2322,"what did the one gay frog say to the other gay frog ? rub it , rub it", what did the perverted frog say to the other ? rub it ., what is the best part about being a horny chick ? rubtainment, why does reple of circum cyclechesamens ? because bubecte
2323,what do you call a doctor who performs abortions ? a yeetiatrician, what do you call a doctor who is a doctor performs abortions ? a jolly ranchian ., what do you call a doctor who is a doctor ? a doctorettric, what do you call a cycle president of here ? a suicide buuuuuuu action
2324,did you hear about the guy who got a boner during a wine tasting ? it turned out it was only a semillon, did you hear about the guy who turned into a semicollon with a boner ? he turned out of a semillon ., did you hear about the guy who turned into a bar ? he turned the semitell ., do you like santa of a boner ? it turned me off . you are turned off
2325,why did the buddhist refuse novocaine ? he wanted to transcend dental medication ., why did the chicken cross the senate senate building ? he wanted to be a little meteor ., why did the bicycle fall down the street ? he wanted to be a little behind ., can t hear what christmas they can t have cycle on female cycleachary cycle ? cycle
