,Original Output,Seq2Seq,VAE,GAN
752,why did the can crusher quit his job ? because it was soda pressing ., why did the sperm bank the job ? because they are both a job ., why did the programmer quit his job ? because he was soda pressing ., how can you do if they are on fraving king on on ?
753,i didn ' t understand the joke about the thrown ball but then it hit me ., i don ' t understand why i ' m not a joke about the joke . but it hit me ., i don ' t understand why people are hit by a joke . it hit me ., don t listen as an astronaut astronaut president as a joke ? it leans forwards you only hit a joke wing .
754,they should put advertisements on the hulk he is a giant banner, what did the hulk say to the hulk ? hulk is hulk, what is hulk is favorite drink ? hulk, hulk has notice how hulk flee of hulk flee many many blub blub
755,how many kids with adhd does it take to change a light bulb ? let is go play on our bikes ., how many kids with adhd does it take to change a light bulb ? let is take to change a light bulb ., my kids with kids on bikes . let me take a light bulb on bikes . let is go to bikes ., how do you let it take only your choice isn ' t it
756,i ' ll never read pride prejudice i ' m way to good to get into a book that probably goes all preachy on, what is good at a book about preachid is good at a book ? preachyy, what is the best way to get a book about preachy ? a book ., wanna know if someone has a book with a book ? because when they forgot what to be premiers
757,everyone is upset about the ufc moving the event from las vegas to los angeles i say it is their los, everyone is upset about the event uficiency is upset about the uficiency is uficiency ., what do you say to the event that is upset ? the los angeles ., how do people say when rich people died like black people . in las banks ? .
758,i ' m relieved the patriots lost no patriot i know would ever beat an eagle ., what did the mexican say to the setting out of the courage to rel ? the eagle ., what is relieved and eagle ? patathy, how often knew pearl jam on his patriot on the king was on on double king and kurt
759,what is donald ducks favorite system of a down song ? chop fuey, what song does a song say to the song ? a song ., what song does a pirate get ? a little lamb ., c which ukraine do you are dangerous holes on ukraine ? they are only indie martbie mart
760,people always ask why my trips to the salon are so quick . i take the shortcut .," why are the most shortcutive salon so fat ? hotelcutalipions , hotelcutalipions , hotelcutalipions .", how many people does it take to take a blackcut ? a quick shock ., whose are only white when they are cvs breeze ? like cvs bapap
761,i ' m getting my girlfriend a prosthetic leg for christmas it is a great stocking filler ., what did the girlfriend get for christmas ? she is getting out of getting a little hoarse, what is the best thing about getting a girlfriend ? getting a girlfriend ., wanna hear kurt cobain has his fishing cane ? because they are only the nicebie .
762,what did one elevator say to the other ? i think i ' m coming down with something ., i think i ' m coming from my new job as something i think i ' m coming ., i think i ' m not coming up with something i ' m coming ., how carlos golfer heading on stairs heading on stairs only has been on donald trump to donald trump
763,what do you call it when two snowmen 69 ? 88, what do you call a mexican who first 88 pounds ? 88, what do you call a fat psychic ? 88, can east poobing if you call it when you coat that the khan . .
764,im starting to think the earth is flat . it just doesnt seem that carbonated .," i think i ' m a tall man with a certain flat earther , but i think you are a tall parent ."," if you think earth is flat , i think earth is flat .", seems rich people worry they are flat isn ' t carbonated it doesnt get his apartment
765,what is the best automotive anti theft device ? a manual transmission, what did the pirate say to the other ? aye matey, what is the best part about a gay man ? a little whine, action hear the north pole threw on the streets on you are on . it is on the b .
766,scientists have discovered a drug that can increase a woman is libido 100 . yeah . its called jewelry ., scientists have discovered that a woman is witness . she discovered that is a small penis .," scientists have discovered a woman is a drug dealer . yeah , yeah , i have a drug dealer ."," can you cashew open a kind of truth ? are a boindt ? yeah , they are a bo"
767,gordon ramsay is very adamant about unprotected sex because every time i call it that he screams it is fucking raw, what do you call a fat chick with no dates ? a moanant, what do you call a rebelant person who climaxed ? an exantant ., ladies know why adam mix of adam stolen content of adam stolen ? adam are the smell of you can
768,"i once put a bunch of grapes in a woman is vagina . she didn ' t say much , she just let out a little wine .", what did the woman say to the woman ? grapes put her vagina is vagina . she is a bunch of grapes ., what did the woman say to the woman when she put a bunch of grapes ? raisin bran ., can you know why gordon ramsay has been voy of like piaser ? by
769,"why do seagulls fly over the sea ? because if they flew over the bay , they would be bagels ."," why do seagulls fly over the sea ? because if flew over the bay , bagels would be bagels .", why do seagulls fly over the sea ? because if they flew over the bay they would be bagels ., how do you make it as a seagull ? because then it was ' bagels .
770,"when it comes to online dating , and i see a woman that i fancy , i apply my new motto carpe dm .", if you are justify you are justify you are justify you are justify you are just a lot of yourself ., what comes after the best part of a woman ? apply for a woman ., think as ed sheeran away when they see it ? because they are in a b
771,"feel like wearing dirty clothing on halloween ? dress up as my teachers , they barely cover anything important .", why are teachers so teachers ? dress up as a lot of teachers ., teachers are like a teachers costume party . they dress up as a choir boy .,light richs owned the kitchen for double doors because he couldn ' t afford his wallet cycles . mount
772,i bought shoes from a drug dealer i don ' t know what he laced them with but i have been tripping all day," i bought tripping all day , but i don ' t know what he laced them with but i have been tripping all day .", i have been shoes from a drug dealer but i don ' t know what he laced them with but i have been tripping all day .," don ' t guys know what he laced him and neon are tripping from his day . they are tripping ,"
773,what is lighter a gallon of gasoline or a gallon of butane ? butane is always lighter fluid ., what is lighter fluid ? butane is lighter fluid ., what is a gallon of gasoline or a gallon of gasoline or a gallon of gasoline butane ? or a lighter fluid, can trump look comey than roller on rollerucated on fire pride than tape ? it doesn ' t play on fire pride .
774,an ethiopian dance party tape a piece of bread to the ceiling put you hands in the air like you just don ' t care, what did the piece of bread is a piece of bread ? a piece of bread, how do you blow bubbles on a piece of bread ? a piece of bread ., can ladies do roses on air air force micheal jordan away on the air buh dum tis dum tis dum tss
775,why did the toilet paper roll down the hill ? to get to the bottom ., what did the hill say to the hill ? the rolling blackout . jk rolling stones . jk rolling stones ., what did the swar say to the bottom of the best way to get a hill ? walking down the bottom of the bottom, sally remembered when the dinosaurs are chasing the top sprevenile ? the top of the land nessman .
776,what do you call a pig that does karate ? a pork chop, what do you call a pig with karate ? pork chop, what do you call a pig with karate ? a pork chop, can do rich on you call it on king cycle on king cycle ?
777,i just spoke to my lazy eye surgeon . i wish he was more energetic ., i wish i spoke to be a spokeergetic . but i spoke to be spoke ., i have spoke to encoticer but i would have spoke to entaticer ., how chuck norris couldn ' t when they are engetic ? they are .
778,what do you call a gay midget ? a low blow ., what do you call a gay midget ? a boo bees, what do you call a gay man ? a receding hare line, how has you call it the rain truck wall has been a smooth jam and call it when you call it rain
779,on a scale of 1 10 drake chose eleven, what did the scale of a scale of a scale of a scale of a scale of a scale of a scale of a scale of a scale of, how to a scale of scale ? a scale of scale .," i do you want his dog , he couldn t smell his sch king king he smell him ?"
780,why did the golfer convert to islam ? because he found out there is 72 holes waiting for him when he dies ., what does a muslim man say when he found out of his side of his new york ? islam, why did the islam offender die ? islam is the best way to islam ., how do you call trading as islam the cucky are ore engines
781,skyrim why are the stormcloaks black and blue ? because they can ' t see the white gold concordat ., what is blue and smells like red ? a skyrim ., what is blue and red ? skyrim, you storm has skyrim wall stoleners sit on skyrim wall on skyrim incidents and blue on skyrim
782,what do you call a man with no hands and a book ? a read only man ., what do you call a man who read a book ? a book ., what do you call a man who can ' t read a book ? a man ., wanna know why mailman blush with his hands . it only made you like hands on hands .
783,it warmed up to 138 in the arabian peninsula today . he was all like oman ? and i was like yemen, how warm is like a gay man ? 12 ., what is the best part about being warmed ? a cold man ., how should you blade do if they ' ll very own bbq ed ? a juan .
784,what is two short of a threesome ? a handsome ., why did the handsome handsome handsome handsome handsome man handsome handsome man ? because if he had a threesome ., what is a four year old person is a threesome ? a handsome person ., moonstyines as people boolein heeikin heeikin heeikin hee hee hee hee hee
785,what is the difference between iron man and iron woman ? iron man is a super hero and iron woman is a command ., what is the difference between a pastry chef and a superhero ? iron man is a command ., what is the difference between iron woman and iron woman ? iron woman is command ., how can t perusing the difference between percking orgasms and two mexicans ? you are on perteen seconds .
786,"my friend said to me , what rhymes with orange i said no , it certainly does not"," what is orange and rhymes with orange ? no , it certainly said , it certainly said it certainly said it certainly said it certainly said it certainly said", my friend asked me what rhymes with orange ? it certainly doesn ' t .," don t rich , ignorance are new knights building you dancing they are dancing worth 22 cuz"
787,"a naked man broke into a church the police chased him around , and finally caught him by the organ .", a man lied about a church on the organ donor he is around on the organ ., what is the best part about having a church ? organ donor, how does you sadl sad when your own pastor has his own ? you are .
788,all pro athletes are bilingual they speak english and profanity ., if curiosity reality they are bilingual if they speak language . they are bilingual ., which language are profanity ? they are profanity, listen as they are like pets it they from they are nor m they nor m it ?
789,"an aneurysm just killed my favourite cliched italian american mafiosa . why , aorta", what did the zen cow say to his favourite killed ? you are avatam ., what killed the worst thing about the synarm ? apostortam, cannomnom fans are done because it is only an cycleest cycle .
790,how many people die every year from cutting bagels ? jwo, what did jociko say to jowo ? jowo, what is a joclist favorite letter ? jo, why do yourude astrowines female female female ? the heewhore
791,a step by step guide of how to tell if your girlfriend is cold 1 she won ' t stop fucking telling you ., how can you tell if your girlfriend is a step 6 step 6 step 6 step 7 step 6 step 7 step 7 step 7 step 7 step 7, how do you tell your girlfriend is girlfriend ? i tell her a little boy ., whose should flowers listen on if you are on a homes on ? da daru
792,why was the boater afraid of buying a hat ? because they were afraid of capsizing ., why did the hat take these hatizing buying a hatizing ? because they are afraid of capsizing ., why did the pirate go to the hat ? he was not buying a hatizing ., how must make a rich baker laugh breaking it is a king franchrannnnnnn
793,i went to paris to see a landmark . it was quite an eiffel ., i went to the beach and i went to the landmark is not quite opinions ., i went to the diffel diffel diffel diffel in the world . i went to the beach . i went to, how should jamno norris land on his land on his landlord because he was not an ed norris
794,jeb bush uses a dangerous method to make a lasting change . jeb, how do you make a jebration joke ? ten tickles ., what do you make a juggling joke ? jiha, how do you hate 22 of his shirts he only make him nail his dick away reads
795,my girlfriend dumped me so i stole her wheelchair guess who came crawling back, to the word to avoid clickbait . i stole my sons account ., what did the pirate say to each other ? he stole the limbo competition ., how do you know duct tape the duct tape ? badumts are badumdias
796,what did the buffalo say when his son left ? bison, what did the buffalo say to the other ? bison, what is the best part about a buffalo ? bison, wanna do rich ignorance on normmets are you like chernobyl
797,knock knock who is theres ? eat my . eat my who ? eat my ass, theres a new ass to eat my ass . i ' m not going to eat my ass ., why is the realest is so much ? because freedom rings ., do you call cuba air march ? sir ? sir on air force on on on on on on on airplane
798,"why is gandalf so good in bed ? because a wizard is never late , nor is he early , he arrives precisely when he means to"," the wizard is good at the bed , and the wizard is good at the other means . it means good , nor the wizard ."," early , i ' m so early , i ' m so early . so i ' m so early . so i ' m so early .", don don ' t blondes wear on bed because he doesn t worry because he doesn ' t worry because it means
799,what do you call a weatherman who really likes steak ? a meateaterologist ., what do you call a rappers who is own meat ? a meateater, what do you call a vampire that is a good joke ? a ceaterologist, can disneyland call has bad and pearl jam away when they are interears
800,if a transgender gets surgery to be turned back to their natural born sex then does that make them a trans former ?, how do you make a tissue dance ? ten tickles, how do you make a gay man ? a little boo bees, wanna know why when popeye play blue landing ? because the cycleman was landing in the hee hee hee hee hee hee
801,why do whole numbers struggle in debates with decimal places ? they have no point to make, i have a debates that points to make me points ., what do you make a debate with donald trump ? a debate ., you can point of crits are a flight of they make you look like a flight
802,i really love playing chess with elderly people in the park . it is just really hard to find thirty two of them willing to do it ., i like to find a fat chick in a park it is a lot like a fat person ., what do you call someone who is a gay person ? a whisk ., how can you keep on the park ? they give the nesthegen nuclear missiles
803,i like my men like i like my coffee i don ' t like coffee, i like my coffee how i like my coffee without pubic coffee ., i like my coffee like i like my coffee like i like my slaves free, rich when they don t like a rainypical cycle . it is not a cycle path
804,what is hodor is favorite cereal ? raisin bran, what is hodor is favourite cereal ? raisin bran, what is hodor is favorite cereal ? sock, me why does black people reveal that one day ? because they are warned to bleading .
805,"a horse walks into a bar the bar tender says , why the long face ? the horse replies , because my alcoholism is destroying my family", a family is destroying a bar . the barman asks the family of alcoholism is destroying my family apart .," a man walks into a bar the bartender says , the family says , i was destroying the family .", whose air candies do with vyzyy holes are destroying your family and you are destroying the family president
806,why should you never trust an atom ? because they make up everything ., never trust atoms they make up everything ., never trust an atom they make up everything ., how can you t custache the fastest fishing astronaut in washington
807,why do they call me the fireman ? cause i turn on the hoes, what do you call a fireman with aids ? ' ' ' t turn off the hoes, why do you call a fireman to be a hoes ? cause they turn hoes ., how can you call aladdin has pudding ? ' cause it only is on on on pride
808,why are asians such bad drivers ? because fried rice can make you drowsy ., how do you make a drowned rash ? petrol games ., how do asians make a drowsy ? drowsy, detectiveyou want to make him parks his own won t getame grateame
809,"those watch for children road signs are weird , i mean , how dangerous can a child be"," i have been saying watch my child is weird way to watch me . i mean , watch me ."," if you watch a child is weird i mean , i mean , i don ' t even watch my child .", mean joke represents you are really angry when it is raining rep away . the red .
810,what is the similarity between a dying person and a piece of shit ? they both see a light at the end of a tunnel ., what is the similarity between light and a piece of shit ? the end of the end of the end of the end of the end of the end, what is the similarity between a piece of shit and a piece of shit ? a piece of shit ., why big red flag is what piece of red ? the red cirlel remes ?
811,how do spirits travel long distances ? the ethereal plane ., what did the pirate say to the other ? aye matey, what is the best part about a gay man ? a little whine, we expected if we are dapical across the weather king it might throw a red operating system
812,what did the black swan call the white duck ? a quacker, what did the duck say to the other duck ? quacker quacker, what did the duck say to the other duck ? quacker, what do if you make lots of white cars like cars ? because chernobyl trucks are on a white house .
813,"you know , a bit of life advice in case anyone ever makes fun of you , make sure you are always carrying a knife .", i don ' t know why people have a knife to have a bit of a knife . but they are a bit touchy subject ., you know how i know a bit of a knife ? it is a bit of a knife ., wanna know when it is c . it was a knife b b b b b b b b .
814,my mom used to tuck me in at night i think she really wanted a girl ., i think my mom used to tuck me in the night i think she really wanted to stay forward ., i think i really remember when i tuck my mom at night . i think she is a girl ., how do you like so if 100 people run in a blegaters in the woods away ? he doesn t get
815,if he was anymore inbred he would be in a sandwich, if a sandwich is a sandwich . it would be a sandwich ., if a sandwich falls into a sandwich shop . it would be a sandwich ., rich do rich on they were on the air balloon to b on .
816,did you hear about the man who was accidentally buried alive ? it was a grave mistake ., did you hear about the man who got caught stealing lizards ? he was a man ., did you hear about the man who got fired from the new car ? he was a man ., man rich we hear of the manrany male husband you hear they wouldnt get rid
817,why did the battery die ? it was bipolar ., why did the bipolar sith tyson feel depressed ? bipolar, i was emotionally emotionally unstable today . i am emotionally unstable ., don t you have an best on a bbq ? because they won t seek on him on mortin places .
818,becoming pigeons can be extremely time consuming it took a pig eons to become one ., i took a new thesaurus today . i took a new thesaurus ., i took a new year old son . i took a few years ago ., how can kanye west do of benin ' king blub blub ? because he enjoyed ben bachian
819,why did the golfer die ? he had a bad stroke, what did the pirate say to the other ? aye matey, what is the best part about a gay man ? a little whine, why do blondes are on female female female female ? you gotta nut it
820,q how do you think the unthinkable ? a with an itheberg ., q what do you think with an itheberg ? a an itheberg, how do you think the unthinkable ? with an itheberg, q what do blondes think when they are chasing the quins ? a tunnel badumns
821,what do you call it when a blind person goes on the internet ? the dark web ., what do you call a fat psychic ? a high school ., what do you call a chinese man ? a good joke ., how should you hate to the internet explorer on internet explorer on on internet are they call a cycle path
822,what is the difference between me and a jew ? i sing in the shower ., what is the difference between a jew and a hippie chick ? a hockey player showers and a jew ., what is the difference between a jew and a jew ? they don ' t sing ., why do blondes do when they don t shower holes ? they don t know it
823,what do you call the hiroshima and nagasaki bombing victims ? rice crispies, what do you call a new zealand in hiroshima yorkpies ? a york end, what do you call it when they call hiroshima on hiroshima ? hiroshima," wanna call , airplane repase holes dropped on hiroshima as a nice driver , it was nice seconds to blub blub"
824,my wife never lets me win just to make me feel good about myself . she also never lets me win just to make me feel bad about myself, how do you win a political joke ? ten tickles, how do you make a bad joke ? they don ' t win anything ., want if you win a death of the cycle path of the cycle path of the cycle path of it only you can make you happen .
825,what do you call a bear with no teeth ? a gummy bear, what do you call a bear with no teeth ? a gummy bear, what do you call a bear with a bear ? a gummy bear, can you do blondes when you are getting away ? because they call me a bear . they are always drowning away .
826,"i told my court appointed therapist i just needed a little piece and quiet . she said , necrophilia is a crime .", i told my women to the other is funeral . i told her i needed a little whine ., i told my friend she was quiet she was quiet . she was a little lamb ., whose should ever been the maxy guy on his b king were quiet he said he needed his b king
827,maturity maturity is when you still have 1 gb of mobile data to use till the last date of billing period, i still haven ' t been a new year old friend . but still still hasn ' t been still ., i still have a new job drilling ., how can youliplphhhlip the cycle path of only their cycle ? they are in the cycle
828,why did the console peasant cross the road ? to render buildings on the other side, why did the chicken cross the road ? to the other side ., why did the chicken cross the road ? to say hello from the other side ., you can t rich t rex for sewage doors don ' t worry . it goes out of
829,a blind man walks into a bar he then walked down the street to get a drink because his head hurt ., a guy walked into a bar the bartender says to get to get a drink .," a man walked into a bar the street was the street . the bartender says hey , i walked into a bar the street", how compliment does jordan cycle when the chocolate enthusiast from larist land edrist because they couldn t get busted
830,"a burglar stole all of my lamps . i should be upset , but right now i am delighted .", my house was upset about the lamps . i was delighted ., why are the house so upset ? because they are delighted ., how do you centre want morm morm mormts are mugged the light .
831,if dwayne johnson stands for president the only thing that could beat him would be a paper .," if a friend has a paper , but i would be president . that would be president .", if you are a joke about a joke about a joke about a paper truck . it would be a real reason ., why do blondes use holes on olive mccan than president holes are you than cats than cats than extrapical cycle
832,how are c and i alike ? memory leaks everywhere ., what is the census is alike ? they both both have both alike ., what is alike ? caitlin jenner is a cyclist .," the washington , should we are the cest it but it is the clerlin b . cler"
833,where do fish get their money ? at the river bank buh dum pshh, money is a lot like money . i ' m not a lot of money ., where do you call money ? a big deal ., people are angry when you fleas flying restaurants on the bbq flaky ? f breeze
834,"i keep getting hit by the same bike , at the same time and place , day after day it is a vicious cycle .", my dog used to chase people on a bike away from the same time i was a bike ., i had a bike a day . the place was the same time .," geologist washington has stronger cycle , people are getting tired when they are getting tired"
835,a truck carrying ice cream spilled out on the highway there was some rocky road ., what did the japanese man say to the highway ? i ' m not a highway ., what is the highway of the highway ? a vinyl shake, do you throw eggs benedict connected chocolate factory bicycle connected ' highway get blown away .
